,ship_to_name,ship_to_name_Kfold_Target_Enc
0,"ABAD JAYA ABADI SENTOSA, BNA, LBNA",900.9230769230769
1,Proyek Jl. Tol BP Blang Bintang,1309.0
2,Proyek Jl. Tol BP Jantho,1364.0
3,"ANDESMONT SAKTI, BNA",1000.0
4,Proyek Jalan Tol BP Seulawah,1375.75
5,Proyek Jl. Tol BP Indrapuri,1150.578847252578
7,Proyek STA 18,1150.578847252578
8,Proyek Tol Aceh PT Adhi Karya BP Bi,1009.2307692307693
9,PT WBP Tol Aceh Wadah Suci,1150.578847252578
10,PT Wajib Usaha Mix,1000.0
11,"RDM ADI JAYA BETON, PT",1033.0
12,RDM BALI BETON MANDIRI,1034.9227278613214
13,"LISA CONCRETE INDONESIA PT,",993.75
14,PRY PURI DHARMAWANGSA VILLAS/CMB,1150.578847252578
15,RDM SCG / OPC  / SCG JAYA READYMIX,1052.5
16,PRY APRON BANDARA / SB / SBB,1150.578847252578
17,RDM SINAR BALI KARYA / PLANT TAMBLA,1040.0
18,ADHI CIPTA INDAH PT. (SHERACON),776.25
19,AFINDI AGUNG PT.,717.3542439615354
20,AM BLOC - PLANT TANGERANG,787.6923076923077
21,JM MUTU UTAMA PT.,1825.52666738887
22,BATA MILENIUM INDONESIA PT.,795.0
23,PRY CIVIL WORKS CONST OF KARIAN/DAE,980.0
24,DEWA BETON ( LEGOK ),790.0
25,RDM FARIKA BETON PL CENGKARENG,788.5714285714286
26,INDOBRICK SEJAHTERA PT.,785.3333333333334
27,JAYACON PANEL UTAMA PT,850.7142857142857
28,"KREASI BETON NUSA PERSADA, PT",800.0
29,LIUNISEN BETONINDO SEJAHTERA PT.,812.6666666666666
30,"MONIER, PT",798.1428571428571
31,PANTONEPILE KWARTATAMA.PT (TGR),785.3333333333334
32,REKAGUNATEK PERSADA PT. (PLANT II),800.0
33,RDM SHENGLI INDUSTRI INDONESIA/SII,1150.578847252578
34,BATCHING PLANT PT SUMBER BATU,1150.578847252578
35,TOP PONDASI INDONESIA PT.,837.7777777777778
36,UNISTRADA GLOBAL MANDIRI PT.,771.6666666666666
37,PRY TOL PLANT KARAWACI/ WASKITA,800.0
38,BENGKULU SETIA ABADI PT.,0.0
39,PT Pebana Adi Sarana,1000.0
40,"RDM ANEKA DHARMA PERSADA, PT",847.6923076923077
41,RDM KURNIA SEJAHTERA / PRY KRT BDR,1150.578847252578
42,KVB BETON INDONESIA PT.,1150.578847252578
43,RDM SCG PLANT YOGYA RING ROAD,832.8571428571429
44,RDM SURYA KARYA SETIABUDI,870.0
45,RDM AGUNG BETON,810.0
46,RDM FARIKA BETON PL PIK,1150.578847252578
47,RDM KAWASAN BERIKAT NUSANTARA / KBN,0.0
48,MAHRI BETON - PLANT JAKARTA,813.1818181818181
49,PARAMATEGAK BETON INDONESIA.PT,800.0
50,SCG READYMIX PLANT KEBON NANAS PT.,1150.578847252578
51,PRY KERETA API CEPAT/ WITON HALIM,790.0
52,PRY RMC STADION BMW,808.0
53,PT Atlas Citra Gemilang,875.0
54,MTU YARD,2000.0
55,ANUGERAH MORTAR ABADI PT.,799.3333333333334
56,JORMIX BERKAH,800.0
57,ARTHA MULIA BETON PT.,789.2857142857143
58,RDM BANGUN MAKMUR UTAMA,1150.578847252578
59,DELIMA JM PLANT CIAMIS,890.0
60,RDM BENUA MULTIGUNA,1150.578847252578
61,BETON ELEMEN PERSADA PT.,810.7142857142857
62,BONNA INDONESIA PT.,1277.5
63,CIPTA MORTAR UTAMA (CIBITUNG),440.0
64,DECON MULTI INDUSTRI PT.,853.1034482758621
65,DEMIX SARANA INDUSTRI INDONESIA PT.,866.0526315789474
66,DJABESMEN PT. (LEMAH ABANG),820.0
67,DUTA SARANA.PT ( I ),1033.6666666666667
68,PBR ETERNIT GRESIK,779.3943946027213
69,FAUZAN PUTRA PERKASA,845.4545454545455
70,GREAT WALL PANELINDO PT.,1150.578847252578
71,RDM GUNUNG RAJA PAKSI,790.0
72,PBR JAYA BLOKMIL INDONESIA,735.0
73,KARUNIA MEGAH WISESA,806.6666666666666
74,CIPAGAMAS PERKASA (RDM LITA BETON),800.0
75,RDM MY MIX (PADALARANG),827.922431140139
76,BUMI JAYA SAMPURNA PT.,792.0
77,PERKASA ADIGUNA PT.,910.0
78,PRY TERMINAL SERVICE PATIMBAN PORT,847.0
79,PRY PELABUHAN RATU / CV GEMA,1000.0
80,PRY PATIMBAN PORT DEVELOPMENT PACKA,1150.578847252578
82,PUNCAK TOP BETONI PT.,1150.578847252578
83,"PRY JALAN APBN, KSO SIS-ADHI-WBP/AD",790.0
84,RDM SEMEN INDOGREEN PLNT CIKARANG,1150.578847252578
85,SO GRAHA PERDANA PT.,897.1408863597171
86,SURYA TATA ALAM RAYA PT.,1150.578847252578
87,RDM TORSINA REDIKON PLANT KALIJATI,780.0
88,RDM TORSINA REDIKON/SUBANG,780.0
89,"TORSINA REDIKON, PT - BANDUNG",701.1111111111111
90,"TORSINA REDIKON, PT - KARAWANG",780.0
91,USI BETON PLANT CIKAMURANG,800.0
92,USI BETON PLANT PAMULIHAN,800.0
93,RDM WANAYASA BETON PANGANDARAN,1060.7142857142858
94,PRY PLANT KALIJATI/WASKITA KARYA,1095.3
95,RDM WASKITA BETON/PLANT CINERE,800.0
96,PBR WITON KARAWANG,777.5277777777778
97,PRY BP WITON BOGOR,440.9311111111112
98,PRY BP WITON KARAWANG,785.5
99,PRY HSR PLANT BAROS,808.0
100,PRY HSR PLANT WALINI,808.0
101,PRY KERETA CEPAT / WITON,790.0
102,RDM WITON JABAR,374.0
103,ZEIN BAHEERA PT.,813.0
104,RDM ABIL KARYA,1150.578847252578
105,ARIES PLANT GEMOLONG,1150.578847252578
106,ARIES PUTRA BETON (SEMARANG),830.0
107,"RDM ARIES PUTRA BETON, PT",710.5612244897962
108,RDM ARMADA HADA G P.CLCP,875.0
109,RDM ARMADA HADA GRAHA PL BUGEL,851.4285714285714
110,RDM BANGUN ANUGRAH BETON NUSANTARA,816.4285714057144
111,RDM BENGAWAN READYMIX PT,850.0000000400001
112,RDM BBM BETON,844.8571428571429
113,RDM BETON BUDI MULYA,883.4615384615385
114,RDM BETON JAYA UTAMA/BJU,893.3031981262176
115,BINTORO BANGUN JAYA,1150.578847252578
116,PRY BUMI SARANA MAKMUR,883.94616665875
117,RDM CEBONG KONSTRUKSINDO / CK,893.3333333173956
118,PBR CIPTA MORTA UTAMA KENDAL,850.6666666666666
119,RDM DBI / PRY RADUGUNTING,850.0000000348485
120,RDM DIRGANTARA BETONINDO / BOYOLALI,863.6363636374318
121,RDM GEONIKA UTAMA PERDANA,900.0
122,RDM HEKSA MANDIRI BETON,895.0
123,RDM INTIMIX MITRA PERKASA,881.9999999839999
124,JATI KENCANA BETON CV/PLANT UNGARAN,1150.578847252578
125,"JATI KENCANA, CV (READYMIX)",850.7142857571429
126,"JATI KENCANA, CV/READYMIX",839.2857142971429
127,RDM JATI KENCANA BETON,860.0
128,"KARYA MANUNGGAL JAYA LESTARI, PT",765.0
129,RDM KARYA ADI KENCANA GRP SELO K,758.3333333333334
130,RDM KARYA INDAH,920.0
131,RDM KEJORA JAYA RAYA,880.7692307538462
132,RDM KURMO BETON,902.5
133,PBR LAKSANA PT,869.99999996
134,RDM LARISSA READYMIX,866.8558996535655
135,RDM MITRA WIGUNA NUSANTARA,869.9999999933334
136,MULTIBETON KARYA MANDIRI PT,874.4444444444445
137,RDM NINGSRI,896.6666666666666
138,NUSA JAYA CONCRETAMA,897.6923076800001
139,RDM PANCA WIRA PUTRA PL KRANYAR,907.0705229793979
140,PBR DUA SEMBILAN,863.3333333333334
141,PRY TOLL SEMARANG - DEMAK,866.8611111111111
142,RDM PRIMA LOGAM,895.55555555
143,RDM PUTRA MANDIRI,885.5384615264614
144,RDM PANEN ISHICON,1150.578847252578
145,RATNA PT. (PLANT GIRIWOYO),1050.0
146,RDM RATNA SANTI LESTARI PL JEPARA,870.0
147,"RODA JAYA PERKASA, PT",883.0
148,RDM SAKA PILAR UTAMA,877.6923076676924
149,"RDM SAMBAS BETON, PT",910.0
150,RDM SATWIGA MUSTIKA NAGA PL SMRG,879.9999999733334
151,RDM SCG PLANT PURWOSARI / SUKOHARJO,1150.578847252578
152,RDM SCG PLANT SOLO RING ROAD,832.8571428571429
153,SCG READYMIX PLANT SEMARANG PT.,1150.578847252578
154,SELO PROGO SAKTI PT.,740.0
155,PRY HULU MIGAS BLOK CEPU TIUNG BRU/,890.0
156,PRY PBTR / SMJ,855.0
157,RDM SURAJAYA TATA MEGAH,878.3333333100001
158,RDM SURYA BUANA INDAH,921.8181818263637
159,"RDM SURYA JAYA BETON, PT",855.4108220816313
160,RDM SURYA TEKHNIK PERKASA,866.3636363636364
161,RDM SUTIKNO TIRTA KENCANA,893.5669501186185
162,RDM TAWAKAL TSANI MAKMUR/TAWAKAL,910.0
163,RDM TRI JAYA CIPTA MAKMUL PL WONOGI,907.1428571428571
164,TRIYAGAN HERMET PERKASA,853.5714285714286
165,RDM VALENTARA SARANA RAYA,1150.578847252578
166,PRY BENDUNGAN JLANTAH,1003.2
167,PRY WASKITA BETON PRECAST PL SOLO,1150.578847252578
168,RDM WIKAN ANDARU / BLORA,1150.578847252578
169,"WIJAYA KARYA BETON, PT",864.8540201650997
170,PBR APLUS PACIFIC (SP)/APLUS PACIFI,1150.578847252578
171,PBR MORTAR AAC BLOCK,830.0
172,PBR ABDILLAH WIDJAYA,900.0
173,RDM ADHIMIX PCI INDONESIA,849.99999996075
174,RDM ADHIMIX PCI INDONESIA/API,849.9999999803749
175,RDM ADHIMIX RMC INDONESIA/ARI,829.9999999929687
176,ABI MANUNGGAL PLANT CITRALAND,717.5
177,ABI MANUNGGAL PLANT PLOSO JOMBANG,900.0
178,BATCHING PLANT ROMO KALISARI,1150.578847252578
179,PBR ANUGERAH SUKSES SEJAHTERA JAYA,849.999984561753
180,ARJAYA PLANT KRIAN,598.1709221011547
181,RDM BAHTERA KURNIA ABADI,907.3333333333334
182,PRY BANGUN JAYA BERSAMA,1150.578847252578
183,PBR BAROKAH JAYA,904.2857142857143
184,PRY BEND SEMANTOK PAKET I,952.0
185,"PBR BUILDING MATERIAL CONSTRUCT, CV",790.0
186,PRY TAMBANG MAS TUJUH BUKIT/BS,907.2
187,RDM CAHAYA INDAH MADYA PRATAMA PT,1150.578847252578
188,CALVARI ABADI,838.3333333333334
189,CISANGKAN PT. PLANT PASURUAN,821.4285714285714
190,CITICON NUSANTARA INDUSTRIES PT.,1150.578847252578
191,CORIN MULIA GEMILANG PT.,0.0
192,RDM CORINDO MAKMUR PERKASA / CMP,930.0
193,PBR CV DEWA DEWA,897.1428571428571
194,RDM DUA PUTRI KEDATON PT,870.2085454505454
195,DUTA BANGSA MANDIRI PT.,1150.578847252578
196,DUTA BANGSA MANDIRI PT.(READYMIX),895.3333333333334
197,DUTA BANGSA PT.,643.9285714285714
198,"DUTA BANGSA READYMIX, CV",903.75
199,DUTA BETON MANDIRI PT.,894.6666666666666
200,DUTA PAVING MANDIRI CV.,897.8571428571429
201,PRY INKA-DUTA BANGSA MANDIRI,915.0
202,RDM DUTA BANGSA MANDIRI,905.0
203,RDM DWI MULYO LESTARI,882.5
204,EDOMIX MEGA BETON CV.,820.0
205,"RDM FEVA INDONESIA, PT",944.0
206,"FOCON INDONESIA, PT",784.6666666666666
207,PBR GUNUNG AGUNG CV,890.0
208,"HUME SAKTI INDONESIA, PT",857.5
209,JAVAMIX CV.,921.4285714285714
210,PRY TIANG PANCANG / JAYA BETON INDO,960.0
211,PBR JAYA ETIKA BETON,904.4117647058823
212,PBR BATARINGAN JAYABRIX INDONESIA,818.3205961899897
213,RDM JISOELMAN PUTRA BANGSA,875.00000230072
214,RDM KALI SURUH KARSA MANDIRI,876.25
215,PBR KARYA SENTOSA,900.0
216,RDM KHARISMA MULTI JAYA,900.0
217,PRY KONSTRUKSI INDONESIA MANDIRI,875.0
218,LANTAI MAS CV.,928.75
219,PBR DJENGGOLO / MAHIR BETON,789.8684790374245
220,PBR MAJU MAKMUR PABRIK TEGEL,1040.0
221,"MERAK JAYA BETON, PT",840.0
222,RDM MERAK BETON  PLANT BOJONEGORO,1150.578847252578
223,RDM MERAK JAYA BETON MADIUN,1150.578847252578
224,RDM MERAK JAYA BETON/MERAK JAYA BET,1150.578847252578
225,MMI PLANT SIDOARJO,1150.578847252578
226,PBR MONIER,815.3009934695012
227,RDM MULTI RAZULKA SAKTI,860.0
228,PBR NOVITA,911.4285714285714
229,PBR PAKIS INDAH,927.2727272727273
230,PBR HUSEIN MUHDAR PUTRA,885.0
231,PBR KARYA INDO BETON,866.3636363636364
232,PBR PAVING PRIMKOPAU JOMBANG,870.0
233,PBR PERDANA KONTRUKSI,985.0
234,"PERUSAHAAN TEGEL & BETON ""ACC""",934.7692307692307
235,RDM PIRANTI UTOMO MAKMUR,881.0
236,PBR PRIMA VOS LIGHT BLOCK,705.2173913043479
237,RATNA PT. (PLANT PACITAN),911.4285714285714
238,RDM REKAYASA ENGINEERING BETON / RE,880.0
239,RDM RESTU ANAK JAYA ABADI BETON/PLA,860.00000097856
240,RDM RESTU ANAK JAYA ABADI BETON/PRY,845.5263157894736
241,RDM ROSAN PRIMA GROUP,851.25
242,"PBR SANTOSO GEMABAHAGIA, PT",808.3333333333334
243,SARI BUMI CONBLOCK CV,930.0
244,RDM SATWIGA MUSTIKA NAGA,894.2857142857143
245,RDM SCG INDONESIA / PLANT PLOSO,1150.578847252578
246,RDM SCG PLANT KEDIRI,850.0
247,SCG READYMIX PLANT GEMPOL PASURUAN,1150.578847252578
248,SCG READYMIX PLANT PLOSO JOMBANG,1150.578847252578
249,SEKAR SURYA CV.,1150.578847252578
250,SEMAR BETON PERKASA(PLANT LAMONGAN),1150.578847252578
251,PBR SETIA CV,937.5
252,SINAR ABADI CITRA SARANA PT. (SACS),920.0
253,"SIRKAH PURBANTARA UTAMA, PT",874.999999540345
254,RDM SRIWIJAYA DELAPAN TUJUH,891.5384615384615
255,RDM SUMBER KALI BETON,870.0
256,RDM SURYA BENGAWAN SAKTI PL KAPAS,900.0
257,SURYA BUANA SENTOSA PT.,1150.578847252578
258,RDM SYAUGI BALAFIF,900.0
259,RDM TIRTA PERKASA ABADI-DAMPIT,919.5454545454545
260,PRY WADUK SEMANTOK/TRIJAYA ADHIMIX,887.1428571428571
261,RDM KRIS JAYA ADYMIX,812.9166684365297
262,RDM TRIJAYA ADYMIX PLANT NGORO,891.4285714285714
263,AYEM MULYA INDAH READYMIX,880.0
264,"KADIRI SARANA BHAKTI, PT",890.6666666666666
265,RDM TUGU BETON SEMESTA ABADI - TUBA,829.9999963662791
266,UBIN SURABAYA PERMAI PT.,1150.578847252578
267,RDM UNGGUL JAYA BETON,862.1431770981798
268,PBR WAHANA CIPTA CONCRETINDO / PRY,980.0
269,PBR WANGI JAYA,959.0
270,PRY WASKITA BETON PRECAST PL JIIPE,1150.578847252578
271,RDM WASKITA BETON PRECAST PLNT PRMB,802.7272727272727
273,RDM WONO SALAM MAKMUR,917.0
274,PBR ZIDAN JAYA,873.8461538461538
275,CITRA MANDIRI REKAYASA PT.,997.86013986014
276,DUA AGUNG PT (READYMIX),956.3823827338007
277,Pry bumi raya city mall,1150.578847252578
278,PT. NUSANTARA JAYA MIX,950.0
279,RDM PBA READYMIX BP BANJAR,928.0
280,PT. KALIMANTAN CONCRATE ENGINNEERIN,498.0
281,PT. SYIFA BETON KONSTRUKSI,1150.0
282,GDG SINCANA PUTRA ABADI,1150.578847252578
283,RDM AJB PRY RDMP PERTAMINA,1075.0
284,RDM BRM PRY RDMP PERTAMINA,1009.2307692307693
285,SAMARINDA,1058.8235294117646
286,KUTAI TIMUR,1175.0
287,CHI CHI JAYA PRY KUTAI BARAT,1150.578847252578
288,KUTAI BARAT,1366.6666666666667
289,PT. ILA BASICA KONSTRUKSI,1250.0
290,KARYA KREASI PRIMA PT,1170.0
291,RDM GARTON BP PROYEK JEMBATAN,1100.0
292,PT. GUNUNG INTAN,1150.578847252578
293,PROYEK JALAN TOL BALSAM SEKSI 234,1150.578847252578
294,ADHI PUTRA KENCANA PT (SOLID MIX),1150.578847252578
295,CV. Arum Abadi (ARDI),894.5833333333334
296,HENI,1150.578847252578
297,SUMBER WINDU AIR MAS PT.,1150.578847252578
298,PT Wika Beton/PPB Lampung Selatan,686.4363636363636
299,Proyek Wika beton Pbb,636.75
300,WIJAYA KARYA BETON PT. (KETAPANG),1150.578847252578
301,PT. INTI TEKNINDO DIAN MANDIRI,1150.578847252578
302,PROYEK WEDA BAY,1275.0
303,PRY BRINGINSILA PAKET 2,850.0
304,PT. ABIPRAYA PRY BRINGINSILA,850.0
305,PT. UTAMA BETON PERKASA,1150.578847252578
306,PRY PELABUHAN LABUAN BAJO,1430.0
307,proyek BD-PKT-APBNP-19 MODERN WIDYA,1396.6666666666667
308,proyek BD-PKT-APBNP-19 TULEN JAYAMA,1150.578847252578
309,PT. DAVICO ENGINERING,1372.142857142857
310,PT Alas Watu Emas,1150.578847252578
311,PT BETON INDO PERKASA,942.6857142857144
312,PT.BETON INDO PERKASA,1120.8641975308674
313,PT. Beton Mitra Perkasa,1150.578847252578
314,"DUMAI JAYA BETON, DUM, DJB",1023.2653061224489
315,RDM FARIKA R. P. / KUBANG RAYA,986.0
316,Pry PLTGU Tenayan Riau/HK,1769.2362611205149
317,Pryk Tol HK Pku Bangkinang,936.0
318,PT Lutvindo Wijaya Perkasa,1205.7142857142858
319,PT.MEKAR ABADI MANDIRI,1250.0
320,PRYK PEMB PLTGU TENAYAN RAYA PT WPK,1150.578847252578
321,PT Rajawali Emas Ancor Lestari,1170.0
322,PT.RIAU BETON MANDIRI,1150.578847252578
323,PT Surya Perkasa Beton,1200.6666666666667
324,BP TLB Pekanbaru,975.0
325,PBR PRECAST / BP I WITON KAMPAR,1182.6666666666667
326,PT. BIB,1150.578847252578
327,BOSTON BETON PT.,999.1428571428571
328,"CITRA BETON, BTM, LOC",912.8125
329,Indo Tirta Suaka,945.0
330,PERKASA BETON BATAM PT.,492.0
331,BETON KARYA PUNGGUR PT.,995.0
332,PT. Remicon Widya Prima,561.6071428571429
333,"UTAMA INDAH MITRA SETIA, BTM, RET",902.6666666666666
334,WIJAYA KARYA BETON - CLT,854.0665266106446
335,PT. APHASKO UTAMA JAYA,1100.0
336,PROYEK JALUR KA LINTAS MAKASSAR,922.1
337,ANEKA BATU PERSADA,953.0
338,BETON MEGAH PERKASA SETIA,1150.578847252578
339,PT. BUMI SARANA BETON,890.0
340,PT. CARLY ALFA TIMUR,960.0
341,CISCO SINAR JAYA,964.6153846153846
342,PT. KAKANTA,960.0
343,PT. MAKASSAR BETON PERKASA,958.8888888888889
344,NINDYA KARYA PLANT KARALLOE,1046.0833333333333
345,OPTIMA JAYA PERKASA,955.7142857142857
346,BETON PERKASA CEMERLANG,992.0
347,PRIMA KARYA MANUNGGAL,948.8888888888889
348,RMC Garton BP Makassar,990.0
349,PT. WIN WAHANA CIPTA MARGA,796.6666666666666
350,PT. SUPER BETON PERSADA,980.0
351,TIMUR UTAMA SAKTI,955.7142857142857
352,TRI STAR MANDIRI,968.8888888888889
353,Proyek WBP B.Plant SHIAM,1150.578847252578
354,PROYEK BANDARA HASANUDDIN,1150.578847252578
355,PALU,1150.578847252578
356,MEGA BETON JAYA,1150.0
357,PT. Super Beton Perdana,1252.3809523809523
358,PROYEK JEMBATAN ASARA & RAHABANGGA,1275.0
359,PROYEK BENDUNGAN LADONGI,1078.8949293967448
360,PT. PRIMA KARYA MANUNGGAL RMC,1042.2222222222222
361,PT. SULAWESI READYMIX,748.1818181818181
362,Pry Apron Bandara Haluoleo Kendari,1020.0
363,PT. NUSANTARA SEJAHTERA BERSAMA,1213.8461538461538
364,PROYEK TOL MANADO BITUNG,1242.2191111111113
365,PT. KINGSTON SULUTINDO,1200.0
366,PT. REVIVAL PUTRA TUNGGAL,1150.578847252578
367,PT.CONBLOC INDONESIA SURYA,1200.0
368,Batching Plant PT Panca Mulia Beton,1044.1666666666667
369,PT MODERN WIDYA TECHNICAL,1270.0
370,Pryk PT Nindya Beton Tol Pdg Sccn,1015.0
371,PT Perkasa Beton,1063.4128591641577
372,Star Indonesia Readymix,1011.3636363636364
373,PT TIARA TELUK JAYA,897.9166666666666
374,BP TLB Kota Padang,1068.241636139996
375,PT Waskita Beton Precast(Plnt Jakab,1118.0
376,Pryk Tol Indrpra PT Agung Beton-SBA,1290.6666666666667
377,"ABADI BETON PERKASA, PT",1234.15625
378,AYU SEPTA PERDANA PEMATANG SELENG,1462.0
379,"BHARATA BETON , PT",1263.8235294117646
380,"DEXTONINDO PERSADA, PT",1221.816993464053
381,PT. Era Karya Konstruksi N-SBA,759.96875
382,Pry Tol TbTinggi Seber HKA SBA,1315.0
383,PT. Jaya Beton Indonesia-SBA,1324.0
384,KREASIBETON ASAHAN III,1300.6666666666667
385,CV. Mitra Abadi Nusantara-SBA,1347.8125
386,PANGERAN BETON,1250.4
387,Proyek Ton Indrapura Kisaran PO 1,1150.578847252578
388,PT Promosi Andalan,804.375
389,"ARJAYA ADIKARA NUSANTARA, PRJ, TEB",1150.578847252578
390,PT. Sumbetri Megah-SBA,1300.0
391,PT. Unggul Sejati Ind SBA,1229.0
392,Pryk Tol WBP BP Purbasari Serbelawa,1390.0
393,PT. Wika Beton-SBA,1182.5
396,"BEURATA SUBUR PERKASA, PT",1380.3924107756
398,"LHOKNGA BETON, BNA",950.9264877629931
399,"SOKI RANA LABA, PT",0.0
402,RDM KRESNA JAYA PERKASA,1055.0
403,RDM MERAK BETON PERKASA PT,1150.578847252578
404,RDM SARI SENTANA ARKA,1030.0
405,RDM SCG READYMIX INDONESIA,1000.0
406,RDM SINAR BALI BINAKARYA,1048.6363636363637
410,ARTHA MULIA SEJATI,805.0
413,"CIPTA MORTAR UTAMA,PT-PLANT CIKANDE",677.0788634684407
416,RDM DWI BETON INDONESIA,1150.578847252578
418,INTERCON JAYA BERSAMA,810.0
420,ZEROWEIS BATAVIA MARKETING PT.,778.8333333333334
421,"PRY LIGNO SPECIALTY CHEMICALS, PT",900.0
422,LOGAM INTI UTAMA SENTOSA,790.0
423,MAJU JAYA MANDIR PT.,1150.578847252578
424,MIRANILA ABADI PT,829.2857142857143
425,PBR MODERN PANEL INDONESIA PT.,0.0
426,REKAGUNATEK PERSADA - PLAN PT.,800.0
427,TRIPALINDO PERKASA PT.,785.3333333333334
429,PT Benteng Beton,0.0
430,RDM Agung Beton P U Tol Bengkulu,1150.0
432,BEJO LUMINTU MINULYO PT.,472.5
433,"PBR DIAMOND BARU, PT",489.05357142857144
434,RDM INTI BETON,460.0
435,PBR KARYA SEHATI UTAMA,934.2857142857143
437,PBR GENTENG MUTIARA,869.0
439,PBR VENTURI TANI MANDIRI,903.561617686974
441,PRY PIK JKT / ADHIMIX RMC,775.0
442,JM MUTU UTAMA PT. C/O BJ,1150.578847252578
444,TORSINA REDIKON PT. (PULOGADUNG),765.625
445,PT Abun Sendi,1220.0
446,PT. Bata Ringan Sumatera,1220.0
447,PT Air Tenang Kerinci,1250.0
448,PT Igasar Semen Padang,1220.0
449,PT Kalyana Mitra Makmur,1230.0
450,PT Mitra Sukses Wijaya Beton,1095.6
451,PT Muria Jaya Beton,1315.0
452,PT Pili & Tris Sunas,1230.0
453,RDM ADHIMIX CIBITUNG,1150.578847252578
454,RDM AGUNG BETON PL DEPOK,810.0
458,AZKA SEJAHTERA PT,1150.578847252578
459,BASF ( CIKARANG ),1150.578847252578
460,PT RAHARJO PERKASA MULTIKARYA,800.0
461,RDM BERDUA MULTI NIAGA,844.5454545454545
463,BOGOR PERSADA INDONESIA PT.,880.0
464,BUKITAPIT BUMI PERSADA PT.,1150.578847252578
465,CONWOOD INDONESIA PT.,837.6923076923077
468,DUTA SARANA.PT ( II ),820.0
471,FOSROC INDONESIA.PT,862.8571428571429
472,GUNA BANGUN JAYA (LEMKRA),860.0
473,PT ONDO METAL INDONESIA,1150.578847252578
474,PBR JAYA BETON INDONESIA,698.3333333333334
475,JAYACON BERSAUDARA PT,810.0
476,RDM JONGGOL KARYA SEMESTA,883.9787965777157
477,KOMPONINDO.B (CIKARANG),812.0588235294117
480,POLA BETON PANTONGRAHA PT.,1150.578847252578
483,PBR SAGAINDO JAYA ABADI,763.6463183921848
484,SCG PIPE AND PRECAST INDONESIA PT,1260.0
490,RDM TRI MUKTI PERTAMA PUTRA,860.0
491,RDM USI BETON PATIMBAN PORT,1150.578847252578
492,USI BETON PLANT CIMALAKA,800.0
493,USI PLANT PELABUHAN PATIMBAN,800.0
494,RDM WIKA BETON/SUBANG,786.59375
496,PBR ANEKA BANGUNAN SARANA GROUP,879.9999999700001
497,ARIES PUTRA BETON,1150.578847252578
498,RDM ARIES PUTRA BETON,839.5489999762559
499,RDM ARISTA KARYA PL GEMOLONG/AK,1150.578847252578
503,RDM BAYU MURTI YASA / BMY,807.8571428342858
504,RDM BERKAH WIJAYA / BW,869.9999999781819
505,RDM BBM PLANT RANDUBLATUNG,836.5
506,"RDM BETON BUDI MULYA, PT",879.1666666666666
507,RDM BINTANG BUMI PERKASA,879.99999998875
508,PBR BUMI ARTHA SAMUDRA,954.0
509,"RDM BUMI REJO TIRTA KENCANA, PT",1150.578847252578
510,RDM CAHAYA SELO MUKTI BARU,873.9999999759999
512,RDM DEWI RATIH PUTERA,866.3633607129075
515,RDM GADING KENCANA MULYA,807.0769230607693
516,PRY HEIBEI JIANKAN/GROBOGAN,868.0
518,INAX INTERNATIONAL CORPORATION PT.,900.0
519,PRY PABRIK SJI / JAYA SAKTI BETON,1150.578847252578
522,RDM JUJUR JAYA BANGKIT,847.1703518125616
525,RDM KH BETON,924.0
527,PBR MARWANI INDAH,974.0
528,RDM MOHANDAS OELOEN,869.9999999600002
529,"RDM NEW CAKTI, PT",879.9999999700001
530,RDM NURCAHYA JAYA LESTARI BETON,864.9999999624999
532,"NUSANTARA BUILDING INDUSTRIES,",836.0
533,PABRIK GENTENG ARCON,958.3333333333334
536,RDM PUTRA ANUGRAH,910.0
537,PBR KURNIA ALAM SEJAHTERA,93.0
538,RDM RADIK JAYA BETON / RJB,667.5
539,PBR RAGAM USAHA PRIMA PT,981.6666666666666
540,RDM RATNA SANTI LESTARI MAKMUR,869.9999999748163
541,"RDM RODA JAYA PERSADA, PT",900.0
542,PBR SA UTAMA PT,970.0
543,PBR SAHABAT MEMBANGUN (MORTAR ESTRI,893.5714285714286
544,RDM SAMBAS BETON,910.0
545,RDM SATRIA SAFIRA GROUP,856.1538461230768
548,SCG READYMIX PLANT SOLO RING ROAD,1150.578847252578
549,"RDM SEMAR BETON PERKASA, PT",892.2222222222222
550,SEMARANG MULTI CONS BAWEN PT.,1150.578847252578
551,RDM SINAR UTAMA KARYA BLORA,836.0
552,"RDM SINAR UTAMA KARYA, PT GRUP",869.99999996
559,PBR TRI PILAR BETON MAS,730.7142857142857
560,RDM TRIYAGAN HARMET PERKASA/THP,896.6666666666666
561,TUGU BETON KROYA PT.,774.0
562,TUGU BETON SEMESTA ABADI PT.,800.0
564,PBR A PLUS PACIFIC,860.9375
565,PBR BATA RINGAN AAC BLOCK,795.1127183895758
568,PBR AMAK FIRDAUS UTOMO PT,807.0
571,PBR AVIA AVIAN PT,910.0
572,PBR BETON ELEMINDO PERKASA,0.0
573,BETON INTI GUNA PT.,1030.0
574,RDM BORNEO JAYA SAKTI,874.2857142857143
575,BUILDING MATERIAL CONSTRUCTION CV.,795.3333333333334
576,PBR BUMI INDAH GENTENG PT,712.0
579,PBR CIPTA MORTA INDONESIA PT,802.6666666666666
580,CITICON NUSANTARA INDUSTRIES,826.4285714285714
581,RDM CITRA INDOBETON ABADI,870.0
582,PBR CONBLOCK INDONESIA PERSADA/CIP,900.0
583,PBR CORIN MULIA GEMILANG,808.3333333333334
586,LISA CONCRETE INDONESIA PT.,1012.3076923076923
587,PBR DRYMIX INDONESIA PT,910.0
592,DUTA BETON MANDIRI PT/DUTA BET,860.0
594,PBR ETEK BUIDING PERFORMANCE INDONE,855.0
595,"PBR PABRIK PAVING FASS(OPC+)/FASS,",870.0
598,GARUDA PAVING CV.,1150.578847252578
599,PBR GARUDA CV,920.0
600,GRAHA JAYA KONKRIT PT.,927.5
601,PBR INDOBANGUN MAKMUR UTAMA,911.4285714285714
602,PBR INTICON,1000.0
603,RDM JATISONO MULTI KONSTRUKSI NGAWI,888.0
604,"JAYA BETON INDONESIA, PT",468.6666666666667
606,PBR JAYA KARYA KONTRUKSINDO,930.0
607,JAYA MULYA CV.,924.0625
609,"TRI PERKASA, PT",896.0
610,KALI SURUH KARSA MANDIRI PT.,880.0
611,PBR KARANG MAKMUR ETERNIT,858.75
614,"PBR KUMALA KIRANA INDUSTRI, PT",874.3333333333334
616,PBR LAWANG INDAH / OPC +,930.0
617,PBR DELTA MULTI SARANA,920.0
618,RDM KERTOSONO/MJB,1150.578847252578
619,"RDM MERAK BETON, P KEDUNG KEDIRI",1150.578847252578
620,PBR MERCU GRAHA GEMPOL PERMAI PT,948.0
624,"PABRIK GENTENG HERO, PT",928.125
626,PAVING FARD,930.0
627,DELTAMAS PRIMA SENTOSA  PT,896.1904761904761
631,PBR PERSADA JAYA CV,922.8333333333334
633,RDM PESONA ARNOS BETON,865.7220289855072
636,PRIORITY ONE INDONESIA PT.,830.0
637,RDM  PUTRA MANDIRI,926.1538461538462
638,PUTRA PRIMA SENTOSA PT.,910.0
639,PBR RABANTON MAJU JOYO ABADI,910.0
640,PBR RAJA PERKASA,898.4615384615385
641,RDM CUSTOM INDONESIA NIAGA PROBOLIN,880.0
643,SAKURA BETON CV.,402.85714285714283
644,SARANA BETON UD,932.6923076923077
646,RDM SCG PLANT KRIAN,825.0
648,RDM SEJAHTERA BERSAMA BOJONEGORO,1150.578847252578
649,PRY BENDUNGAN SEMENTOK / SIS,1150.578847252578
650,SHICA JAYA SENTOSA PT.,895.3333333333334
651,PBR SINAR ABADI CITRA SARANA PT,888.8942439559578
652,RDM SINAR BALI - SITUBONDO,880.0
653,PBR SUMBER BETON,870.0
655,PBR SURYA BUANA,870.9090909090909
658,"TJIWI KIMIA, PT (PABRIKAN)",901.1111111111111
660,"RDM TRIPLES, PT/TRIPLES",870.0
661,PBR TUREN INDAH UD,868.0
663,PRY UTAMA BETON PERKASA / UBP,1150.578847252578
668,BINTANG PRATAMA MIX PT.,1088.2692307692307
669,"RDM CITRA MANDIRI REKAYASA, PT",989.7641025641026
670,DUTA INDO LESTARI PT.,1071.4285714285713
671,PRY TAMBANG EMAS/SERINDING SUMBER M,1558.0
674,BANJARMASIN,1046.923076923077
680,PT. Kaltim Jaya Beton,1106.1538461538462
685,PT. KARYA USAHA MANDIRI,1150.578847252578
686,PT. Surya Bakti Group,1113.3333333333333
689,LOMBOK MULIA JAYA,952.7272727272727
690,PT. SINAR BALI,997.7777777777778
691,JAYAPURA,1150.578847252578
693,PT ARTHA KINDO PERKASA,1250.0
694,PT. ARTHA KINDO PERKASA,1150.578847252578
696,BP Berkat Yakin G Bengkalis,1230.0
697,PT. Betonindo Perkasa,1190.5555555555586
699,PT Kunango Jantan Riau Daratan,995.0
700,PT. LUTVINDO WIJAYA PERKASA,1150.578847252578
701,PT Panca Mulia Miximindo Abadi,1150.578847252578
703,PT Riau Beton Mandiri,1205.7142857142858
704,BP Riau Mas Bersaudara Balai Raja,1150.578847252578
705,PT Riau Mas Bersaudara,1150.578847252578
707,PT Wiradjaja Prima Kencana,1150.578847252578
708,PT. Boston Beton,1055.5
709,"JUTAM READYMIX CONCRETE, BTM, RET",900.0
718,MACCON GENERASI MANDIRI,940.0
719,PT. Makassar Indah Graha Sarana,958.0
720,MALEA ENERGY,1030.0
721,CV. SUMBER GALIAN (RMC),965.3333333333334
723,PRY NEW PORT MAKASSAR,831.6666666666666
724,Proyek PT. VALE,1100.0
726,PT. IKRAM TIGA BERLIAN,1097.5
727,PT. TRIMITRA MAJU PERSADA,990.0
728,STAR MITRA SULAWESI,954.4444444444445
731,PT. Mega Beton Jaya,1159.2307692307693
732,PT. Utama Beton,1158.5714285714287
734,PT. NINDYA BETON,728.695652173913
736,PROYEK TOLL MANADO-BITUNG,1249.84
737,PT. CAHAYA ABADI LESTARI,960.0
742,CV. BINTANG SEJAHTERA,1230.0
743,Batching Plant PT JSI,1025.0
744,PT Kunango Jantan Padang Pariaman,1030.6666666666667
747,BP Prima Beton Cakrawala,969.2
748,Proyek Pemb PLTMH Balai Selasa PT G,1251.7504158836314
749,PT. STATIKA MITRA SARANA,1017.5
752,PT TRI JAYA PUTRA KAB SOLOK,1312.1875
756,"BINIVAN KONSTRUKSI ABADI , PT",1302.857142857143
760,EMA PT Karunia Beton Lestari,1239.5
761,"KREASIBETON NUSAPERSADA, NS1, DIR",1043.8461538461538
762,PT. Medan Beton Teguh P SBA,1258.2
765,Pryk Rel KA Rantau Prapat Labusel,1150.578847252578
766,PT SUKSES BETON,1186.0
767,PT. DAKA MEGA PERKASA,1140.0
769,RAPI ARJASA,1286.25
771,EMA PT Rihitindo Toba Beton,1461.25
