,ship_to_name,ship_to_name_Kfold_Target_Enc
10620,PRY BEND. LEUWIKERIS / WBP,429.3333333333333
10628,"WIJAYA KARYA JATIWANGI, PT.",799.6931818181819
10630,SURYA FAJAR BUANARAYA PT.,794.6153846153846
10636,RDM ARYA BETON,875.4545454363637
10637,RDM BAROKAH MERAPI MANDIRI,885.0
10639,RDM BENGAWAN READYMIX PT,858.5714278285177
10640,RDM BBM BETON,876.4000004994502
10648,KARSA PILAR KONSTRUKSI / PRY REHAB,922.5
10650,RDM KURMO BETON,898.3333333333334
10653,RDM MITRA BETON PERKASA,868.3333322662388
10655,"NUSANTARA BUILDING INDUSTRIES,",844.0
10657,RDM PANCA WIRA PUTRA PL KRANYAR,914.1666666666666
10664,PBR SAHABAT MEMBANGUN (MORTAR ESTRI,910.8333333333334
10665,"RDM SAMBAS BETON, PT",910.0000019293005
10667,PRY HULU MIGAS BLOK CEPU TIUNG BIRU,1150.578847252578
10668,PBR UD SUMBER JAYA,930.7142857142857
10672,RDM SURYA BETON PRECAST PL GREMENG,875.0000000095833
10673,RDM SURYA CAKRA SAKTI - KLATEN,877.5000000087999
10674,RDM SUTIKNO TIRTA KENCANA,899.2857169272122
10678,"RDM UNGGUL PERDANA-GEONIKA, KSO",886.6666666666666
10684,RDM ADHIMIX RMC INDONESIA/ARI,841.999999994375
10685,PRY PERUM KINGS PARK-BATU/AOP,1225.0
10687,PBR ANUGERAH CONCREATE CEMERLANG,945.6
10690,PBR ARYA PUTRA JAYA,870.0
10691,RDM ASIA BETON,820.6000025568179
10692,PBR BANYUWANGI INDO RAYA PT,811.6666666666666
10694,RDM BORNEO JAYA SAKTI,873.0769230769231
10695,PRY PEMB PERUM PERMATA JINGGA II/BA,1225.0
10697,RDM CAHAYA INDAH / PRY JLN RIGID LA,820.7813333315834
10699,CISANGKAN PT. PLANT PASURUAN,825.7142857142857
10701,PRY PERUM GARDEN CITY/CITRA GARDEN,1212.5
10706,DUTA BANGSA READYMIX,907.3076923278857
10709,RDM DUTA BETON MANDIRI PUCANGSARI,897.2727272727273
10710,RDM DWI MULYO LESTARI,898.75
10711,EDOMIX MEGA BETON CV.,808.25
10713,GRAHA JAYA KONKRIT PT.,926.0
10717,PRY INDO BUMI PRATAMA,1150.578847252578
10718,PRY SUNCITY BIZ PORONG/INDO PURNA,854.2857142857143
10728,PBR KARANG MAKMUR ETERNIT,858.6666666666666
10730,RDM KONSTRUKSI INDONESIA MANDIRI TU,876.4285714285714
10736,PBR MANNA UD,956.0
10737,PBR MONIER,817.9676601361679
10738,RDM NINDYA MINARTA / BEND TUGU,800.0
10739,"PABRIK GENTENG HERO, PT",926.25
10740,PBR PAKERINT PT,956.0
10745,"PERUSAHAAN TEGEL & BETON ""ACC""",944.0
10748,RDM PIRANTI UTOMO MAKMUR PL TUREN,980.0
10751,"PUTRA PRIMA SENTOSA, PT",902.5
10752,"RAJA KARYA, UD",895.0266666666668
10756,RDM RESTU ANAK JAYA ABADI BETON/PLA,860.0000015419116
10757,SAKURA BETON CV.,654.0
10758,"PBR SANTOSO GEMABAHAGIA, PT",853.75
10759,SARI BUMI CONBLOCK CV,928.0
10760,RDM SATWIGA MUSTIKA NAGA,905.7142857142857
10763,SCG READYMIX SURABAYA,833.3333333333334
10767,PBR SETIA CV,936.0
10769,PBR SINAR ABADI CITRA SARANA PT,880.9090909090909
10770,"SPEED MIX, PT",773.0769230169676
10772,RDM SEKAR WANGI SENTOSA,809.0
10773,RDM SUGIH WARAS JAYA/PRY BEND. JATI,686.9398571396786
10774,RDM SUGIH WARAS PL SOKO / PRY SOLO,1150.578847252578
10775,SUMBER JAYA (PAB. STONE - CRUS,927.1428571428571
10778,SUPERIOR PRIMA SUKSES PT.,812.8571428571429
10780,RDM SURYA BENGAWAN SAKTI PL KAPAS,905.0
10783,RDM TRI JAYA CIPTA MAKMUR PT,884.999998383063
10785,"TRI JAYA ADYMIX, CV",876.9230744354815
10790,PBR WANGI JAYA,958.1818181818181
10791,WBP / PRY PEL  GRESIK,286.0
10792,RDM WONO SALAM MAKMUR,935.0
10793,PBR ZIDAN JAYA,893.5714285714286
10795,CITRA MANDIRI REKAYASA PT.,1028.24975024975
10796,DUA AGUNG PT (READYMIX),1008.0
10797,DUTA ASA JAYA,1178.0
10798,DUTA INDO LESTARI PT.,1085.7142857142858
10800,CITICON BANJARMASIN,938.0
10803,PT. CAHAYA PURNA NUSARAYA,436.0
10805,BANJARMASIN,1037.857142857143
10807,RDM BERAU NUANSA BETON,1190.0
10809,PRY PEMBANGUNAN GEDUNG DPR & BUPATI,0.0
10811,FORTUNA ANEKA SARANA TRIGUNA,2005.0
10813,PT. Kaltim Jaya Beton,1105.7142857142858
10814,RDM LANGGENG ARSIH MANDIRI,1114.7937520590929
10817,RDMP Balikpapan,1210.44
10821,RDM HOKKIE MIX,1150.578847252578
10822,PT. Surya Bakti Group,1112.6315789473683
10825,PT Rindang 31 Pratama,1150.578847252578
10826,Proyek Wika beton Pbb,714.5882352941177
10829,RDM ANUGRAH NUANSA KASIH,1160.0
10831,PT. RAJAWALI PUNCAK JAYAWIJAYA,990.0
10835,PT Bangun Purba Setahi,1345.3721022394343
10839,BP MBM Batu Basurek,978.8888888888889
10846,PBR / BP I WITON KAMPAR (BP),1218.6
10855,WIJAYA KARYA BETON - CLT,905.9439775910369
10858,PT. KARYA UTAMA BETON,955.7142857142857
10859,LOMPULLE,976.0
10861,MAEL LESTARI,980.0
10862,PT. Makassar Indah Graha Sarana,957.2727272727273
10863,PRY BENDUNGAN PAMUKKULU,1020.0
10867,PT. CIPTA AGAR UTAMA,1058.888888888889
10873,PT. Super Beton Perdana,1243.4782608695652
10875,RDM RAZAN MANDIRI PERKASA,1174.0
10876,RUNGGU PRIMA JAYA,1176.8045404012921
10877,PROYEK SMELTER,1046.25
10878,PT. BUMI SARANA BETON,736.25
10879,PT. PRIMA KARYA MANUNGGAL RMC,708.0
10881,DIEGO PUTRA KONSTRUKSI,1172.5
10882,PT. BATU LICIN BETON ASPALT,1299.090909090909
10884,PROYEK WIJAYA KARYA BETON SMELTER K,745.0
10887,PT.SAMAEROT TRI PUTRA,1040.0
10891,PT Kunango Jantan Padang Pariaman,1033.4545454545455
10906,PT. Jaya Beton Indonesia-SBA,1235.4545454545455
10907,"KREASIBETON NUSAPERSADA, NS1, DIR",1048.6666666666667
10908,"MEDAN BETON TEGUH PERKASA, PT",1261.5882352941176
10911,Nittoc Proyek Asahan III,1348.0
10913,PT. Pangeran Beton Nusntra-SBA,1179.4666666666667
10917,Proyek Tol Indrapura Kisaran PO 6E,1150.578847252578
10919,PT. YALA-SABARITHA KSO SBA,1350.0
10920,RAPI ARJASA,1285.0
10923,"ABAD JAYA ABADI SENTOSA, BNA, LBNA",942.6491428571428
10933,PLTA Peuasangan PT KNS Hyundai E&C,1508.0
10935,Proyek Pembangunan PLTA Krueng Peus,1425.0
10937,PT Krueng Meuh,1320.0
10939,PT Wajib Usaha Mix,1028.125
10941,RDM ADI JAYA BETON PLANT SINGARAJA,1031.3333333333333
10942,"RDM ADI JAYA BETON, PT",1032.5
10944,"RDM HARAPAN JAYA BETON, PT",1032.6470588235295
10946,LISA CONCRETE INDONESIA PT.(BALI),1472.5
10949,RDM SCG PLANT DENPASAR,1050.0
10950,RDM SINAR BALI BINAKARYA PL TAMBLAN,1077.5
10952,ADHI CIPTA INDAH PT. (SHERACON),781.0714285714286
10953,RDM AGUNG BETON PL TANGERANG,1150.578847252578
10954,BANGUN BANTALA INDONESIA,400.0
10955,BINTANG BETON INDONESIA PT,773.75
10961,PT JBI PLANT TANGERANG,790.0
10964,MAJU JAYA MANDIRI CV.,816.9230769230769
10965,"MONIER, PT",798.1176470588235
10966,PANTONEPILE KWARTATAMA.PT (TGR),718.5276164080865
10968,SAVIRCON MANDIRI INTERNUSA PT.,696.2388250319284
10970,PRY SULFINDO ADIUSAHA,1290.0
10972,UNISTRADA GLOBAL MANDIRI PT.,776.4285714285714
10978,PT Selamat Group Beton Pryk Tol Ben,1150.0
10979,PT Roda Teknindo,1005.0
10983,PBR KARYA SEHATI UTAMA,934.0
10987,PBR VENTURI TANI MANDIRI,904.0992592592593
10990,RDM FRESH BETON INDONESIA PL MERUYA,0.0
11001,ABAD BARU BETON (PT.WMP),1450.0
11008,ARTHA MULIA BETON PT.,801.875
11010,PRY APBD TASIKMALAYA & CIAMIS,760.0
11026,FAUZAN BETON / PRY RIGID JLN CIPANA,1150.578847252578
11034,HUTAMA PRIMA/PRY BEND. LEUWIKERIS,811.4285714285714
11038,KARUNIA MEGAH WISESA,800.0
11039,MAPEI INDONESIA CONSTRUCTION,994.0
11043,BUMI JAYA SAMPURNA PT.,813.3333333333334
11048,RDM FRESH BETON INDONESIA PL SENTUL,795.0
11050,PT PUNCAK TOP TRADER INDONESIA MAJA,790.0
11052,PRY KAWASAN INDUSTRI DELTAMAS,780.0
11055,TORSINA  / PRY APBD BEKASI,766.0
11057,TORSINA REDIKON PL LAGADAR,770.0
11060,PRY REVITALISASI KALI WIDASARI,760.0
11064,PBR WBP PLANT EX PCI SUBANG,892.0833333333334
11071,PRY BP WITON KARAWANG,783.2916666666666
11074,RDM WIKA BETON/SUBANG,790.425
11079,RDM AL ATTAR,1150.578847252578
11080,PBR ALAM DAYA SAKTI,881.6666666666666
11086,RDM BINTANG BUMI PERKASA,879.9999999863637
11091,RDM GADING KENCANA MULYA,834.85714284
11093,PRY PLTG TAMBAKLOROK,0.0
11095,PBR INDO TEGEL PT,967.8571428571429
11096,PBR INTI BETON / PRY BOGOWONTO,960.0
11098,INTICON PLANT BOGOWONTO,896.4375
11100,RDM INTIMIX MITRA PERKASA,871.66666665
11104,PRY KWS INDUSTRI BATANG / JKB,816.6666666666666
11106,RDM WIRA BHAKTI MULIA,895.0
11111,RDM NINGSRI PL SAYUNG / NINGSRI,896.25
11116,PRY BATCHING PLANT KIT BATANG PKT 1,788.5
11119,RDM PUTRA MANDIRI,882.948717936218
11123,RDM SAKA PILAR UTAMA,881.4285714028573
11125,RDM SCG PLANT SEMARANG,827.7857142857143
11126,RDM SCG PLANT SOLO,820.0
11130,RDM SURAJAYA TATA MEGAH,882.8571428342858
11132,PKS / TIRTA YASA,1150.578847252578
11133,"RDM TIRTA YASA, PT",910.0
11136,PBR WARINGIN PUTIH,902.7272727272727
11138,RDM FANIDITA SARANA PLANT KENDAL/FA,910.0
11143,PRY KAWASAN INDUSTRI BATANG BP 2 /,1150.578847252578
11145,WITON / PRY APBD PEMALANG BATANG,841.5
11146,ALAM MAHA TEDUH SURABAYA,873.3333333333334
11151,APB MOJOKERTO / PRY SMELTER GRESIK,1386.42699020486
11162,BETON CITRA ABADI PLANT 4,864.0
11164,CALVARY ABADI PLANT 2,780.0
11165,CALVARY ABADI PLANT 3,780.0
11167,"PBR CORIN MULIA GEMILANG,PT",812.28125
11171,LISA CONCRETE INDONESIA PT.(NGORO),820.0
11172,DUTA BANGSA MANDIRI PT.(READYMIX),814.6875
11173,DUTA BETON MANDIRI PT.,837.5
11177,PBR GARUDA,907.3333333333334
11181,RDM HARAPAN BARUSEJAHTERA PLASTIX M,871.6607272702728
11203,SUPERIOR PRIMA SUKSES.PT,832.0
11207,TRIPILAR BETONMAS PT.,206.71868024272894
11211,WBP PLANT SOLO,0.0
11217,PBR BATA RINGAN AAC BLOCK,807.5845387921818
11219,PBR AMAK FIRDAUS UTOMO PT,842.2222222222222
11232,RDM BETON BUDI MULYA PL KALITIDU,783.0
11234,BETON INTI GUNA PT.,1010.0
11238,PROFIL MAS / PRY BENDUNG PLESUNGAN,1150.578847252578
11243,PBR CV DEWA DEWA,887.0
11247,DUTA BANGSA CV.,842.6666666666666
11257,PRY SUTT 40 KV GRATI GIS & TOWER/HP,1238.0
11259,RDM JATISONO MULTI KONSTRUKSI,898.8888888888889
11261,PBR JAYA BETON INDONESIA,641.6666666666666
11262,PBR JAYA ETIKA BETON,907.3684210526316
11267,LANTAI MAS CV.,927.0
11269,PBR DJENGGOLO/ MAHIR BETON,914.9999999932292
11273,RDM MULTI RAZULKA SAKTI,867.5
11279,PBR DUTA BETON GROUP,936.6666666666666
11289,RDM RATNA PT,874.2857142857143
11292,RDM RESTU ANAK JAYA ABADI BETON/PRY,836.2962962962963
11293,RDM ROSAN PRIMA GROUP,851.4285714285714
11295,SARANA BETON UD,933.125
11298,BHAKTI TAMA PERSADA / PRY JL RIGID,1150.578847252578
11301,PRY PEMBANGUNAN PABRIK / PT SWPI,1213.0
11303,PRY UNMUH SIDOARJO/SIRKAH PURBANTAR,795.1134285650714
11304,PBR SURYA BUANA,872.6666666666666
11307,PRY GREEN LIVING RES THP2/ TIDAR,1225.0
11309,"TIRTOBUMI ADYATUNGGAL, PT",871.0
11312,PRY WADUK SEMANTOK/TRIJAYA ADHIMIX,885.7692307692307
11318,"KADIRI SARANA BHAKTI, PT",901.4285714285714
11324,PRY TAMBAK OSOWILANGUN/MA,1188.0
11327,"RDM CITRA MANDIRI REKAYASA, PT",1012.0498168498166
11329,MEGA JAYA BETON,1122.0
11339,RDM KARYA WISMA MANDIRI,1232.0
11342,RDM LIBRA READYMIX,1150.578847252578
11343,SAMARINDA,1055.5555555555557
11344,PT. Prasetya Mulia Indo Jaya,1036.875
11346,RDM SSK BP BALIKPAPAN,1061.6666666666667
11349,TB SMS,990.0
11352,PT Wika Beton/PPB Lampung Selatan,737.5043478260869
11353,Proyek Wika Beton PPWB Tegineneng,744.4939803439803
11357,PT. SINAR BALI SUMBAWA,1075.0
11360,PT SURYA INTAN HARMONI JAYAPURA,1360.0
11361,PT. ADIKARYA TANRISAU,660.0
11364,"DUMAI JAYA BETON, DUM, DJB",897.3409523809522
11367,JM MUTU UTAMA PT.(PU DUMAI),2052.1008403361343
11370,PT Mekar Abadi mandiri,1220.0
11371,PT Nusa Jaya Beton,0.0
11373,PT Kawasan Industri Kampar,1211.47848149545
11378,PBR PRECAST / BP I WITON KAMPAR,1156.7857142857142
11382,PT Bintang Rezky Tirta,960.0
11385,PT. PASSOKORANG,1127.5
11388,ANDIKA BANGUN PERKASA,955.0
11393,RDM BUMI SARANA BETON,955.0
11399,PROYEK BENDUNGAN KARALLOE,1112.5
11403,PT. Mega Beton Mandiri,966.1538461538462
11407,PT. Ridwan Jaya Lestari,1065.0
11409,TJAKRINDO MAS,972.1875
11412,VARIA USAHA BETON (RMC),977.0
11414,PT. Konstruksi Mega Beton,1167.142857142857
11419,PROYEK BENDUNGAN LADONGI,1067.0033405998554
11420,PT. NINDYA BETON,693.3333333333334
11422,PT. PRIMA DWI UTAMA,1170.0
11424,PT. KINSTON SULUTINDO,1222.5
11425,PT. SINAR PEMBANGUNAN SEMESTA,1230.0
11432,PT TRI JAYA PUTRA DHARMASRAYA,1355.8221180608728
11434,Pryk Tol Indralaya Prabumulih - Hut,374.26666666666665
11435,RDM PolaBaja PG Plant Ogan Ilir,1150.578847252578
11436,WBP BP PALEMBANG,1400.6666666666667
11437,WBP Gasing,1240.8
11439,PT. Abadi Beton Perkasa SBA,1212.361111111111
11445,HK SIS Tol Binjai Pgkln Brandan 3,1107.142857142857
11446,Pryk Tol Tb Tinggi HK,756.0
11447,PT. Jaya Sentrikon Ind SBA,388.8888888888889
11448,EMA PT Karunia Beton Lestari,1243.6666666666667
11449,"KARUNIA BETON LESTARI, PT",660.625
11450,KREASIBETON ASAHAN III,1336.0
11452,Proyek Tol Indrapura Kisaran PO 6D,1150.578847252578
11453,Proyek Tol Indrapura Kisaran PO 7A,1150.578847252578
11454,Proyek Tol Indrapura Kisaran PO 7B,1150.578847252578
11455,PT Ade Lestari Sejati,1530.0
11456,PT Dalihan Naluto Group,1350.0
11458,PT Sasta Konstruksi,1499.3333333333333
11462,T TON,1325.0
11467,Proyek RSUD Kota Sabang,1150.578847252578
11472,PRY Tol Aceh PT Adhi Karya BI,1100.0
11474,Bohana Jaya Nusantara Aceh Utara,888.0
11476,PT Galih Medan Persada Sec 2,1400.0
11479,Waskita Bendungan Rukoh 120,1435.0
11482,RDM BALI BETON MANDIRI,1034.642857142857
11485,RDM SCG / OPC  / SCG JAYA READYMIX,1061.5384615384614
11488,AFINDI AGUNG PT.,425.9125463769213
11493,CHINA HARBOUR INDONESIA PT.,1260.0
11496,PRY CIVIL WORKS CONST OF KARIAN/DAE,956.0
11498,RDM FARIKA BETON PL CENGKARENG,474.0
11500,"JAYA BETON INDONESIA,PT",804.5454545454545
11502,MAHRI BETON - PLANT TANGERANG,817.6923076923077
11505,PRY PALMAS PROJECT ENGINEER,979.1666666666666
11507,SAVIRCON MANDIRI INTERNUSA(STDU),668.7611749680716
11520,"RDM ANEKA DHARMA PERSADA, PT",853.7931034482758
11525,"PBR DIAMOND BARU, PT",480.31666666666666
11530,MAHRI BETON - PLANT JAKARTA,817.6923076923077
11533,FRESH BETON MERUYA / PRY APBD,760.0
11538,PT Maras Bangun Persada,1270.0
11544,PT Toggle Rekayasa,1250.0
11546,PBR ANICON PRECAST,968.0
11547,ANUGERAH MORTAR ABADI PT.,803.75
11548,PT ARINO KARYA NUSANTARA,1150.578847252578
11549,BANGUN BETON PRATAMA /SBR,807.5
11550,BASUKI RAHMANTA PROYEK JONGGOL,812.5
11551,BENTENG BANGUN SEJAHTERA PT.,925.0
11552,BETON ELEMEN PERSADA PT.,815.8823529411765
11554,PRY ABTON PLANT SUBANG,818.5
11556,CATUR PUTRA MAPAN PT.,804.4187423005851
11557,PRY GUDANG CILEUNGSI/CKS,848.3333333333334
11565,FAUZAN PUTRA PERKASA,851.6666666666666
11574,LAMERTA BANGUN PRIMA PT.,796.1764705882352
11577,RDM MY MIX (PADALARANG),839.2857142857143
11579,PRY REHAB JLN PAMANUKAN-PALIMANAN,803.0
11580,"GRIYATON, PT",799.3333333333334
11582,FRESH BETON SENTUL / PRY APBD,780.0
11586,RDM PRIMA SAMPONO  PL CIAMIS,880.0
11589,TORSINA / PRY APBD KALIJATI,770.0
11591,PRY PONDOK PESANTREN AL ZAITUN  & R,760.0
11593,USI PAMULIHAN / PRY TOL CISUMDAWU P,760.0
11596,WBP / PRY  PORT YANGON  PL EX PCI S,1150.578847252578
11598,WBP / PRY  PORT YANGON  PL SADANG,192.5
11610,RDM YASA PATRIA  PERKASA,819.1666666666666
11616,ARIES PUTRA BETON (SEMARANG),830.3308823529412
11618,"ARMADA HADA GRAHA, PT (READYMI",857.3333333333334
11619,RDM BANYU PUTIH JAYA INDAH,900.0
11623,RDM BETON JAYA UTAMA/BJU,890.9090909090909
11625,RDM DEWI RATIH PUTERA,868.5714285457144
11629,PRY KENDAL INDUSTRIAL PARK-HUTAMA K,846.5
11631,RDM HGMS ASLI ABADI/PRY JEMB. MLOWO,875.0
11632,RDM JAYA KARYA BETON BREBES,810.0
11636,RDM KH BETON,923.75
11638,"PBR BALTON KURNIA ABADI, PT",960.0
11641,CV ARISTA KARYA,874.5454545263638
11642,RDM MITRA WIGUNA NUSANTARA,878.4615384538463
11643,RDM NINGSRI/PRY KITB,854.0
11644,RDM RAHMAH JAYA MANDIRI,887.2727272727273
11650,PKS / NHR,860.0
11653,RDM PRABASWARA / PRY KITB,860.0
11655,PUTRA MANDIRI BETON,894.095238095238
11656,RAGAM USAHA PRIMA MANDIRI / PRY BOG,1010.0
11657,RDM RATNA SANTI LESTARI MAKMUR,869.9999999760001
11660,"RODA JAYA PERKASA, PT",887.4999990885993
11661,RDM SAFINA JAYA PL JEPARA,852.0
11662,RDM SAFINA JAYA PL PATI,847.5
11663,RDM SATRIA SAFIRA GROUP,858.5714285392856
11664,RDM SATWIGA MUSTIKA NAGA PL SMRG,878.9999999720001
11672,RDM SURYA JAYA BETON / PL PATI,850.0
11673,"RDM SURYA JAYA BETON, PT",857.4999999749998
11690,PRY APB SMELTER BP MOJOKERTO,1485.0
11706,PBR CONBLOCK INDONESIA PERSADA/CIP,910.0
11707,"PBR BETON MAS, CV",880.0
11721,EDOMIX BETON READYMIX.CV,790.7142857142857
11724,"PBR PABRIK PAVING FASS(OPC+)/FASS,",873.75
11729,"PBR TIGER, PT",901.4285714285714
11750,PBR HUSEIN MUHDAR PUTRA,892.8571428571429
11759,RAJA KARYA UD.,784.0545454545453
11781,RDM TIRTA PERKASA ABADI,985.0
11790,RDM WASKITA BETON PRECAST PLNT PRMB,874.0
11805,PRY BENDUNGAN SEPAKU SEMOI,1142.5
11818,VUB BP BONTANG,1164.0
11842,PT.BETON INDO PERKASA,962.5252525252552
11857,PT Citra Beton,925.0
11863,PT Sinar Alamindo Pratama,378.0
11866,PT MAMUJU TAMBUAN ENERGY,1150.578847252578
11872,PT. CARLY ALFA TIMUR,978.0
11889,PT GUNBUSTER NICKEL INDUSTRI,1070.0
11900,PT. SULAWESI READYMIX,494.1666666666667
11905,Batching Plant PT Panca Mulia Beton,1076.4285714285713
11918,PT TIARA TELUK JAYA,934.2986934325522
11921,Waskita PLN Tower Bayung Lencir,1140.0
11932,Pryk Bend Lau Simeme PP / PSN,1129.090909090909
11934,Proyek Tol Indrapura Kisaran PO 7C,1150.578847252578
11940,PT SUKSES BETON,1189.2307692307693
11951,Proyek Sigli - STA Lamtamot,1408.0
11955,BP Lueng Guci Konstruction,1300.0
11959,PT Epse Makmur Beton,1393.890760044735
11962,PT Kenpura Alam Nanggroe,1365.0
11972,RDM RIADIMIX,1150.578847252578
11975,SINAR BALI BINAKARYA / PRY DERMAGA,1430.0
11984,HALIM INDUSTRI BETON RINGAN PT.,1150.578847252578
11996,PBR WBP BOJONEGARA,691.25
11999,PRY.WIKA GEDUNG UNIVERSITAS TERBUKA,740.0
12001,BENGKULU SETIA ABADI PT.,708.0
12009,RDM ANEKA DARMA PERSADA,840.0
12011,BEJO LUMINTU MINULYO PT.,708.75
12015,RDM KURNIA SEJAHTERA BETON,883.6363659418239
12020,SAETI CONCRETINDO WAHANA PT.,722.0
12024,CV Putri Icha Lestari,1130.0
12030,APB / PRY TOL CISUMDAWU - PSN,803.0
12032,PRY APB TOL CISUMDAWU,803.0
12055,PBR BINTANG SELATAN IMACON PRECAST,1150.578847252578
12069,SIKA INDONESIA PT. - PLANT CIBITUNG,783.75
12070,PBR SURYA TATA ALAM RAYA,812.5
12098,RDM BANGUN ANUGRAH BETON NUSANTARA,877.0588235082354
12101,ABTON PLANT GROBOGAN,1150.578847252578
12122,"KARYA MANUNGGAL JAYA LESTARI, PT",920.0
12125,RDM KARYA ALAM ABADI,921.0
12131,"RDM NISAJANA HASNA RIZQY, PT",869.99999996
12138,PBR DUA SEMBILAN,872.5
12142,RDM JO CSM-WIKA BITUMEN,880.0
12151,RDM SCG PLANT KUDUS,825.0
12155,PRY KALI LODJI PEKALONGAN,860.0
12162,WIKA YASA KSO - PRY KITB,780.0
12201,"RDM FEVA INDONESIA, PT",878.3333333333334
12209,"INDO RAYA KUPANG, PT / PRY PLTMG NT",1150.578847252578
12237,"SABAR NARIMO, PT",880.0
12246,SUPERIOR PRIMA SUKSES PT.(BLESSCON),820.3571428571429
12259,"WAHANA CIPTA CONCRETINDO, PT",920.0
12262,WITON PASURUAN / SIP (SPRINTPRO),820.0
12272,PT Prohaba Jaya Mandiri,1160.0
12284,RDM DAP BETON,1055.7142857142858
12285,RDM DBA BP BALIKPAPAN,1150.578847252578
12293,PT. Palmas Project Engineering,976.6666666666666
12299,PT SURYA MEGA JAYA,1150.578847252578
12314,"Citra Prasasti Margaraya, PT",1505.0
12317,PT. PERISAI PRIBUMI,1300.0
12318,PT. SATYA KELANA BHAKTI,1315.0
12343,PBR PRECAST / MP I WITON KAMPAR,1150.578847252578
12344,PBR PRECAST / MP I WITON KAMPAR PO,1188.0
12345,PT Sempurna Precastindo,955.0
12347,PT Boston,546.625
12349,PT Jeni Prima Putra,955.0
12357,RDM ARMADA MIX,1016.6666666666666
12359,ANEKA BATU PERSADA,952.7272727272727
12366,PBR MORTAR KALLA BETON,0.0
12377,PT. Mulia Trans Marga,976.0
12380,RDM SALBI,962.5
12396,RDM PERKASA RAYA,1230.0
12416,Waskita PLN Tower Linggau,525.0
12429,Pryk Tol Binjai Hakaaston,1212.7777777777778
12440,PT PP Presisi Tol Inkis,1296.25
12441,Proyek Tol Indrapura Kisaran PO 8C,1150.578847252578
12444,PT Sabaritha Perkasa Abadi,1298.0
12445,PT Sinar Matahari Baru,1400.0
12481,TRANS BETON INDONESIA,750.0
12485,ZEROWEIS BATAVIA MARKETING PT.,795.3333333333334
12493,BP JURUMUDI/PRY RUSUN PENJ PLUIT,720.0
12494,BP SERPONG/PRY TOL SERBARAJA,720.0
12495,SBB BP CILEGON,825.0
12497,SBB BP PLTU JAWA 9-10,1200.0
12502,PRY WIKA COLLINS,740.0
12526,DYNAPUMP - TIDUNG (FAS),1150.578847252578
12527,SBB - BP. KALIBARU,925.0
12529,SBB ANCOL/PRY RUMAH POMPA ANCOL,1150.578847252578
12530,SBB BP ANCOL,959.4
12531,SBB PGADUNG/PRY RUSUN CAKUNG BARAT,750.0
12539,PT Multi Aston Nusa,1190.0
12582,FRESH BETON SUKABUMI / PRY APBD,790.0
12585,BP JATIMELATI/PRY APART GRD AVENUE,690.0
12586,BP SENTUL1/PRY UNIV ISLAM INTERNT,755.0
12589,BATCHING PLANT BANDUNG,770.0
12590,BATCHING PLANT KANCI(1926),750.0
12591,SBB BP KARAWANG,750.0
12592,SBB SENTUL / PRY SUMMARECON,755.0
12601,PBR WBP PL CIBADAK / PRY BOCIMI,330.0
12630,"HAKA UTAMA, PT / PRY PENINGKATAN KA",1030.0
12666,DYNAPUMP NUSAKAMBANGAN K.KUNING,1230.0
12667,SBB /PRY PLTU KARANGKANDRI,1240.0
12668,SBB BP CILACAP,1053.3333333333333
12669,SBB CILACAP/PRY PLTU KARANGKANDRI,1150.578847252578
12673,RDM VUB BANYUPUTIH / PRY KITB 1.4,780.0
12674,RDM VUB BREBES / PRY AREA BREBES,880.0
12675,RDM VUB SOLO/PRY APARTEMEN SOLO,840.0
12692,ASINDO KARSA JAYA PT.,922.5
12751,RDM SCG PLANT MANYAR,815.0
12754,BATCHING PLANT GEDANGAN,920.0
12755,BATCHING PLANT PANDAAN,970.0
12768,PBR VUB PANDAAN,830.0
12769,RDM VUB MALANG,830.0
12776,PT NARHINA BETON SEJAHTERA,980.0
12788,RDM PANGLIMA ANTASARI BETON,1040.0
12790,PT ANUGERAH MANDIRI 95,1215.0
12805,PT. MANDALA UTAMA BETON,979.1666666666666
12806,PT. Utama Beton Perkasa Pry Mandali,1150.578847252578
12826,PT Perkasa Beton Readymix,910.0
12833,PT.BATAM INDO BANGUNAN,791.6666666666666
12844,SINAR ALAMINDO PRATAMA PT.,1001.6666666666666
12848,PT BUMI MINERAL SULAWESI,900.0
12854,RDM Karya Pembangunan Rezeki,1040.0
12895,PRY WBP TOL PASPRO PL MUNENG,622.2857142857143
12911,PT. PP URBAN,1309.0
12926,PT. MURIA SUMBA MANIS,1140.0
12927,PT. PP Proyek Jalan Alor NTT,1340.0
12984,PRY WIKA PLTU PALU,1150.578847252578
12998,BP Prima Beton Cakrawala,963.0
13000,Proyek Pemb PLTMH Balai Selasa PT G,1252.4625542103702
13033,Proyek Tol Indrapura Kisaran PO 8A,1303.5
13034,PT Promosi Andalan,1033.5
13055,PT Sorik Merapi Abadi,1500.0
13056,KSO Pulau Bintan Bestari & Setia Ni,1425.0
13068,BETON PRIMA INTI PT. (SBI),0.0
13088,PBR WBP PL PAMULANG,395.0
13109,PRY LINTAS BATAS NATUNA ADHI KARYA,392.44444444444446
13126,PT Wahyunata Arsita,1262.5
13132,PRY APB SMELTER BP SADANG PURWAKART,1298.0
13141,PRY BENDUNGAN CIAWI/BRANTAS,601.875
13213,AYUDI PERSADA / PRY KITB,1150.578847252578
13230,PANCA KARYA SENTOSA,860.0
13237,KARYA ADI KENCANA / PRY REKONS JL K,900.0
13238,PBR KARYA UTAMA,882.5
13254,RDM PANCA WIRA BETON,860.0
13259,RDM PUTRA MATARAM PERKASA,1150.578847252578
13260,RDM RADIK JAYA BETON / RJB,898.0
13263,GORIP NANDA GUNA / PRY KITB,865.0
13272,PBR SINAR TERANG,940.0
13288,RDM FANIDITA SARANA KSO/WIDJOJO KOE,902.0
13290,WIDYA SAPTA CONTRACTOR / PRY TOL JO,1150.578847252578
13291,WIKA - YASA KSO / PRY KIT BATANG,1150.578847252578
13311,PT BETON PRIMA INDONESIA,1150.578847252578
13360,PBR HAVANA TEGUH PERTIWI,838.4615384615385
13385,"PRY WAHYU AGUNG, PT",1150.578847252578
13395,PT. BANUA BETON,996.6666666666666
13396,PT MULTI USAHA PEMBANGUNAN,1070.0
13403,RDM KIE BP BONTANG - DYNAMIX,1170.0
13425,PT Yasa Patria Proyek Sirkuit Manda,986.6666666666666
13433,PT. PASELA JAYA,1395.0
13434,Adhi Karsa Karya Pratama,1150.578847252578
13437,PT. Betonindo Perkasa,1198.0000000000034
13439,Pry PLTGU Tenayan Riau/HK,1650.1754751861852
13441,PT Lutvindo Wijaya Perkasa,1202.2222222222222
13442,BP MBM Rimbo Panjang,955.0
13449,"SUMBER PENIKARYA, PT",1095.888888888889
13450,PBR PRECAST / BP I WITON KAMPAR,1171.15
13451,PT Mustika Anugerah Semesta,1150.578847252578
13452,PT.BATAM INDO BANGUNAN,760.0
13453,BOSTON BETON PT.,1055.5
13454,PT Boston,651.5
13455,"CITRA BETON, BTM, LOC",912.825
13456,PT Citra Beton,513.888888888889
13458,REMICON WIDYAPRIMA PT.,813.0769230769231
13459,PT Sinar Alamindo Pratama,374.0
13461,"UTAMA INDAH MITRA SETIA, BTM, RET",908.4375
13462,WIJAYA KARYA BETON - CLT,885.6123511904766
13463,PT. BUMI KARSA,1150.578847252578
13464,PROYEK JALUR KA LINTAS MAKASSAR,925.1071428571429
13465,ANDIKA BANGUN PERKASA,945.0
13467,RDM BUMI SARANA BETON,933.0
13468,CISCO SINAR JAYA,960.0
13471,PT. KAKANTA,990.0
13472,RDM Karya Pembangunan Rezeki,950.0
13474,MAEL LESTARI,960.0
13475,NINDYA KARYA PLANT KARALLOE,1047.75
13477,PRY NEW PORT MAKASSAR,815.0
13478,PT. Mega Beton Mandiri,960.0
13480,PT. Ridwan Jaya Lestari,1057.142857142857
13483,TIMUR UTAMA SAKTI,950.0
13484,TJAKRINDO MAS,968.0769230769231
13486,Witon Kima Precast,788.21875
13487,PROYEK SMELTER GNI MOROWALI,1150.578847252578
13488,RDM RAZAN MANDIRI PERKASA,1150.0
13489,RUNGGU PRIMA JAYA,1175.70271404627
13490,PT. SELARAS MANDIRI SEJAHTERA,1177.6545775480786
13491,PROYEK SMELTER,1048.4615384615386
13492,PT. BUMI SARANA BETON,668.5714285714286
13493,PROYEK BENDUNGAN LADONGI,1025.653716721241
13494,PT. NINDYA BETON,533.3333333333334
13495,PT. PRIMA KARYA MANUNGGAL RMC,492.85714285714283
13496,DIEGO PUTRA KONSTRUKSI,1150.0
13497,PT. BATU LICIN BETON ASPALT,1300.0
13498,WIN WAHANA CIPTA MARGA PLANT AMEROR,1175.0
13499,PROYEK TOLL MANADO-BITUNG,1249.7428571428572
13500,PT. KINSTON SULUTINDO,1200.0
13501,PT. SINAR PEMBANGUNAN SEMESTA,1200.0
13505,PT Kunango Jantan Padang Pariaman,1028.4761904761904
13507,Proyek Pemb PLTMH Balai Selasa PT G,1252.37129922517
13509,PT Dhamor Utama,1222.5
13511,KSO PT Sinar Cerah Sempurna,1150.578847252578
13512,PT. STATIKA MITRA SARANA,1000.625
13513,Star Indonesia Readymix,1002.5
13514,BP TLB Kota Padang,1095.4509691258777
13516,PT TRI JAYA PUTRA KAB SOLOK,1306.4615384615386
13517,Pryk Jalintim Sumsel,1150.578847252578
13519,Pryk Tol Indralaya Prabumulih - Hut,102.66666666666667
13520,Hasta Prajatama Utama,1150.578847252578
13521,PT Tiga Mustika Beton,1150.578847252578
13522,WBP Gasing,1232.0
13523,"ABADI BETON PERKASA, PT",1224.75
13524,PT. Abadi Beton Perkasa SBA,1224.75
13525,PT. ABC Beton Indonesia SBA,1310.0
13526,"BINIVAN KONSTRUKSI ABADI , PT",1400.0
13527,Pryk Tol Binjai HK,526.0
13528,"KREASIBETON NUSAPERSADA, NS1, DIR",1056.3636363636363
13529,PT. Medan Beton Teguh P SBA,1249.3076923076924
13530,PT. Pangeran Beton Nusntra-SBA,1238.0
13533,Proyek Tol Indrapura Kisaran PO 8B,1150.578847252578
13534,Proyek Tol Indrapura Kisaran PO 9 A,1150.578847252578
13535,PT Promosi Andalan,1137.5
13538,PT Prima Jaya Sentosa Energy,1150.578847252578
13540,RAPI ARJASA,1270.0
13541,PT SUKSES BETON,1200.0
13542,Pryk Tol Binjai HK - Sukses Beton,1350.0
13544,Pryk Tol Binjai Pngklan Brandan WBP,862.5
13545,Wika Jembatan Tanoponggol,379.5
13546,Wijaya Karya Beton Tbk.PT PPB Sumut,702.6785714285714
13548,PT Galih Medan Persada,1100.0
